	subject	verb	object	sentence	label	aspect	masked_sen
67	landlord	refuse		What can you do if the landlord refuses to make repairs to the premises?	0	refuses	What can you do if the landlord [MASK] to make repairs to the premises?
68	cowboy	ride		A pair of cowboys rode into town.	0	rode	A pair of cowboys [MASK] into town.
69	column	rise		Columns of smoke rose from fires burning out of control.	0	rose	Columns of smoke [MASK] from fires burning out of control.
70	tear	roll		The tears rolled down the poor child's face.	0	rolled	The tears [MASK] down the poor child's face.
71	horse	run		I rarely have a chance to see my horses run.	0	run	I rarely have a chance to see my horses [MASK].
72	reporter	rush		Reporters rushed to the scene.	0	rushed	Reporters [MASK] to the scene.
73	doctor	say		The doctor said it would heal fine that way.	0	said	The doctor [MASK] it would heal fine that way.
74	crowd	scream		The crowd screamed and sang along as usual.	0	screamed	The crowd [MASK] and sang along as usual.
75	immigrant	settle	Hawaii	Hawaii of course was settled by Polynesian immigrants from Tahiti about one thousand years ago.	0	settled	Hawaii of course was [MASK] by Polynesian immigrants from Tahiti about one thousand years ago.
76	man	shake	head	The young man shook his head.	0	shook	The young man [MASK] his head.
77		shrug	shoulder	He just shrugged his shoulders.	0	shrugged	He just [MASK] his shoulders.
78	submarine	sink	ship	The ship was sunk by a Soviet submarine.	0	sunk	The ship was [MASK] by a Soviet submarine.
79	cat	sit		His cat was now sitting expectantly upon his feet.	0	sitting	His cat was now [MASK] expectantly upon his feet.
80	baby	sleep		Most babies sleep primarily in their parent’s room for months.	0	sleep	Most babies [MASK] primarily in their parent’s room for months.
81	drawer	slide		The top right-hand drawer slid open at a touch.	0	slid	The top right-hand drawer [MASK] open at a touch.
82	foot	slip		Theo's foot slipped on the slick stone.	0	slipped	Theo's foot [MASK] on the slick stone.
83	Dean	slip	knife	Dean slips his own knife into the sheath in the back of his pants	0	slips	Dean [MASK] his own knife into the sheath in the back of his pants
84	Frodo	smile		Frodo smiled amid his tears.	0	smiled	Frodo [MASK] amid his tears.
85		spread	glue	Use a small brush to spread glue on the egg.	0	spread	Use a small brush to [MASK] glue on the egg.
86	statue	stand		For a while, the headless statue stood in the front yard of a neighboring home.	0	stood	For a while, the headless statue [MASK] in the front yard of a neighboring home.
87	Frodo	stare		Frodo stared at the stone in his palm for a few moments.	0	stared	Frodo [MASK] at the stone in his palm for a few moments.
88	thief	steal	photo	The thief stole the photo from the museum in Prague.	0	stole	The thief [MASK] the photo from the museum in Prague.
89	engineer	steal	secret	The engineer stole Boeing trade secrets.	0	stole	The engineer [MASK] Boeing trade secrets.
90	Blair	step		Blair stepped out of the car to meet him.	0	stepped	Blair [MASK] out of the car to meet him.
91	Beth	stick	tongue	Beth turned her head and stuck her tongue at me.	0	stuck	Beth turned her head and [MASK] her tongue at me.
92	Frank	stretch	arm	Frank stretched his arm out across the length of the back of the bench.	0	stretched	Frank [MASK] his arm out across the length of the back of the bench.
93	woman	suffer	pain	Some women suffer no pain at all.	0	suffer	Some women [MASK] no pain at all.
94	bar	support	weight	The bar supports the full weight of the person.	0	supports	The bar [MASK] the full weight of the person.
95	human	survive		Can humans survive without water?	0	survive	Can humans [MASK] without water?
96	man	sweep	floor	The old man was sweeping the floor.	0	sweeping	The old man was [MASK] the floor.
97	shark	swim		There were over a dozen whale sharks swimming around us.	0	swimming	There were over a dozen whale sharks [MASK] around us.
98	politician	talk		Have you ever seen a politician talking to a rich person on TV?	0	talking	Have you ever seen a politician [MASK] to a rich person on TV?
99	patient	tear	cuff	Older patients may tear the rotator cuff during the dislocation.	0	tear	Older patients may [MASK] the rotator cuff during the dislocation.
100	scientist	think		Scientists think they have discovered the first liquid sea outside of Earth on Saturn's largest moon, Titan.	0	think	Scientists [MASK] they have discovered the first liquid sea outside of Earth on Saturn's largest moon, Titan.
101	Lebanese	throw	rock	Lebanese throw rocks at Israeli soldiers.	0	throw	Lebanese [MASK] rocks at Israeli soldiers.
102		tie	ribbon	Then you can also tie a ribbon around the card to make it look pretty.	0	tie	Then you can also [MASK] a ribbon around the card to make it look pretty.
103	ladder	touch	ground	The longer of the two ladders is not touching the ground.	0	touching	The longer of the two ladders is not [MASK] the ground.
104	passenger	travel		All passengers travel in cabins, and all cabins have a private shower & toilet.	0	travel	All passengers [MASK] in cabins, and all cabins have a private shower & toilet.
105	Jim	turn		Jim turned and walked into the waiting room.	0	turned	Jim [MASK] and walked into the waiting room.
106	thunder	wake		One morning at daybreak, thunder woke him. 	0	woke	One morning at daybreak, thunder [MASK] him. 
107	Misha	walk	dog	Misha walks his dogs in the park.	0	walks	Misha [MASK] his dogs in the park.
108	pedestrian	walk		Pedestrians walk between cafes and other small businesses.	0	walk	Pedestrians [MASK] between cafes and other small businesses.
109		wear	helmet	We always wear helmets when we are riding bikes.	0	wear	We always [MASK] helmets when we are riding bikes.
110	volunteer	welcome	visitor	Today volunteers welcome visitors and groups of all sizes.	0	welcome	Today volunteers [MASK] visitors and groups of all sizes.
