	label	aspect	sentence	masked_sen	subject	verb	object
399	1	strahlt	Ist die Stimme klar , laut und sicher , so strahlt dies ebenfalls Stärke aus .	Ist die Stimme klar , laut und sicher , so [MASK] dies ebenfalls Stärke aus .		ausstrahlen	Stärke
400	0	ausgestrahlt	Danach werden - auch über Satellit - alle Programme nur noch digital ausgestrahlt .	Danach werden - auch über Satellit - alle Programme nur noch digital [MASK] .		ausstrahlen	Programm
401	0	ausgestrahlt	Die fertige Sendung wird im Bürgerfunk auf Radio Erft ausgestrahlt .	Die fertige Sendung wird im Bürgerfunk auf Radio Erft [MASK] .		ausstrahlen	Sendung
402	0	ausgestrahlt	Mal sehen , ob das auf MTV tatsächlich mehr als einmal ausgestrahlt wird .	Mal sehen , ob das auf MTV tatsächlich mehr als einmal [MASK] wird .		ausstrahlen	
403	0	Ausgestrahlt	Ausgestrahlt wird die Serie voraussichtlich ab November jeweils montags bis freitags um 14.10 Uhr .	[MASK] wird die Serie voraussichtlich ab November jeweils montags bis freitags um 14.10 Uhr .		ausstrahlen	Serie
404	0	ausgestrahlt	Die Show rund um den Garten wird um 21:15 Uhr ausgestrahlt .	Die Show rund um den Garten wird um 21:15 Uhr [MASK] .		ausstrahlen	Show
405	0	Ausgestrahlt	Ausgestrahlt werden wird die kleine Session im Laden des Kiez-Kultclubs in Kürze bei CoreTV .	[MASK] werden wird die kleine Session im Laden des Kiez-Kultclubs in Kürze bei CoreTV .		ausstrahlen	Session
406	0	ausgestrahlt	Erst am 25.12 wurden die ersten Sendungen ausgestrahlt .	Erst am 25.12 wurden die ersten Sendungen [MASK] .		ausstrahlen	Sendung
407	0	ausgestrahlt	Die Sendung wurde im Februar dieses Jahres ausgestrahlt .	Die Sendung wurde im Februar dieses Jahres [MASK] .		ausstrahlen	Sendung
408	1	angeschmiert	Wenn man vorher nicht ausgiebig in der Halle trainiert hat ist man angeschmiert .	Wenn man vorher nicht ausgiebig in der Halle trainiert hat ist man [MASK] .		anschmieren	
409	1	angeschmiert	Ich glaube der Verkäufer hat mich angeschmiert .	Ich glaube der Verkäufer hat mich [MASK] .	Verkäufer	anschmieren	
410	1	angeschmiert	Kein reiner Genuss : Wer sich beim Einkauf aufs Etikett verlässt , ist angeschmiert .	Kein reiner Genuss : Wer sich beim Einkauf aufs Etikett verlässt , ist [MASK] .		anschmieren	
411	0	angeschmiert	Danke , hatte mich schon mit Kerzenöl angeschmiert .	Danke , hatte mich schon mit Kerzenöl [MASK] .		anschmieren	
412	1	angeschmiert	Sie sind beide angeschmiert , wenn sie kein Netz haben .	Sie sind beide [MASK] , wenn sie kein Netz haben .		anschmieren	
413	1	angeschmiert	Gut für den Verkäufer , der Empfänger ist aber angeschmiert wenn nix im Packet drin ist .	Gut für den Verkäufer , der Empfänger ist aber [MASK] wenn nix im Packet drin ist .		anschmieren	Empfänger
414	1	angeschmiert	Also gut , ich befürchte auch , diese Schurken haben gemerkt , dass wir sie angeschmiert haben .	Also gut , ich befürchte auch , diese Schurken haben gemerkt , dass wir sie [MASK] haben .	wir	anschmieren	Sie
415	0	angeschmiert	Ich habe ihm einmal seinen Rock von hinten mit Kreide angeschmiert .	Ich habe ihm einmal seinen Rock von hinten mit Kreide [MASK] .	ich	anschmieren	Rock
416	0	angeschmiert	Die Box hab ich dann mit einer Zahnspachtel mit Leim angeschmiert .	Die Box hab ich dann mit einer Zahnspachtel mit Leim [MASK] .	ich	anschmieren	Box
417	0	anschmieren	Dieses Vorhaben bietet fachliche Anleitung zum Bremsen nachstellen , Kette anschmieren und Reifen flicken.	Dieses Vorhaben bietet fachliche Anleitung zum Bremsen nachstellen , Kette [MASK] und Reifen flicken.		anschmieren	Kette
418	0	angeschmiert	Die ganze Küche versaut , sogar teilweise die neu gestrichenen Wände angeschmiert	Die ganze Küche versaut , sogar teilweise die neu gestrichenen Wände [MASK]		anschmieren	Wand
419	0	angeschmiert	Die Box hab ich dann mit einer Zahnspachtel mit Leim angeschmiert .	Die Box hab ich dann mit einer Zahnspachtel mit Leim [MASK] .		anschmieren	Box
420	1	ausgereift	Apache ist solide , die Performance ist auf jeden Fall in Ordnung und die Dokumentation ausgereift .	Apache ist solide , die Performance ist auf jeden Fall in Ordnung und die Dokumentation [MASK] .	Dokumentation	ausreifen	
421	1	ausgereift	Ausserdem möchte ich betonen , dass diese Idee noch nicht wirklich ausgereift ist .	Ausserdem möchte ich betonen , dass diese Idee noch nicht wirklich [MASK] ist .	Idee	ausreifen	
422	1	reifte	Als wir jetzt an die neuen Aufnahmen gingen , reifte die Idee aus .	Als wir jetzt an die neuen Aufnahmen gingen , [MASK] die Idee aus .	Idee	ausreifen	
423	0	ausgereift	Einkauf Pfirsiche schmecken eigentlich nur dann wirklich gut , wenn sie am Baum ausgereift sind .	Einkauf Pfirsiche schmecken eigentlich nur dann wirklich gut , wenn sie am Baum [MASK] sind .	Pfirsiche 	ausreifen	
424	1	ausgereift	Schon unter Vorgänger Kurt Otto war die Mannschaft technisch ausgereift .	Schon unter Vorgänger Kurt Otto war die Mannschaft technisch [MASK] .	Mannschaft	ausreifen	
425	1	ausgereift	Die vorliegenden Planungen sind technisch ausgereift und das Projekt ist baurechtlich umsetzbar .	Die vorliegenden Planungen sind technisch [MASK] und das Projekt ist baurechtlich umsetzbar .	Planungen	ausreifen	
426	1	ausreifen	Er mochte lieber Menschen die ihre Meinung sagten um eine Idee wirklich ausreifen zu lassen .	Er mochte lieber Menschen die ihre Meinung sagten um eine Idee wirklich [MASK] zu lassen .		ausreifen	Idee
427	1	ausgereift	Carbon als Material ist ausgereift und gute Entwickler haben das ohne jedes Restrisiko im Griff .	Carbon als Material ist [MASK] und gute Entwickler haben das ohne jedes Restrisiko im Griff .	Carbon	ausreifen	
428	0	ausreifen	So kann sich die Hagebutte bis zum Herbst gut entwickeln und ausreifen .	So kann sich die Hagebutte bis zum Herbst gut entwickeln und [MASK] .	Hagebutte	ausreifen	
429	1	ausgereift	Früher hätte man sie nur in Ausnahmefällen operiert , weil die Methoden nicht so ausgereift waren .	Früher hätte man sie nur in Ausnahmefällen operiert , weil die Methoden nicht so [MASK] waren .	Methode	ausreifen	
430	1	ausgereift	Jeder weisst , dass Windows Vista noch nicht ausgereift ist .	Jeder weisst , dass Windows Vista noch nicht [MASK] ist .	Vista	ausreifen	
431	1	ausgereift	Der FM Transmitter von DNT macht absolut keine Probleme und ist recht ausgereift .	Der FM Transmitter von DNT macht absolut keine Probleme und ist recht [MASK] .	Transmitter	ausreifen	
432	1	ausgereift	Technisch ausgereift , präzise in Verarbeitung und Konstruktion , Performance in Reinkultur .	Technisch [MASK] , präzise in Verarbeitung und Konstruktion , Performance in Reinkultur .		ausreifen	
433	1	ausreifen	Andere Technologien müssen erst noch ausreifen .	Andere Technologien müssen erst noch [MASK] .	Technologie	ausreifen	
434	0	reifen	Die anderen Früchte reifen sowieso nicht mehr aus .	Die anderen Früchte [MASK] sowieso nicht mehr aus .	Frucht	ausreifen	
435	0	ausreifen	Diese liegt so früh im Jahr , dass die Weine eigentlich noch nicht richtig ausreifen konnten .	Diese liegt so früh im Jahr , dass die Weine eigentlich noch nicht richtig [MASK] konnten .	Wein	ausreifen	
436	0	ausreifen	Hier herrschen optimale Bedingungen , damit sich das Baby weiterentwickeln und ausreifen kann .	Hier herrschen optimale Bedingungen , damit sich das Baby weiterentwickeln und [MASK] kann .	Baby	ausreifen	
437	0	ausreifen	So können noch weitere Früchte ausreifen .	So können noch weitere Früchte [MASK] .	Frucht	ausreifen	
438	0	ausgereift	Mädels in diesem Alter sind in der Regel körperlich noch gar nicht so weit ausgereift .	Mädels in diesem Alter sind in der Regel körperlich noch gar nicht so weit [MASK] .	Mädel	ausreifen	
439	0	reifen	Die Früchte der Brombeere reifen sehr unterschiedlich aus .	Die Früchte der Brombeere [MASK] sehr unterschiedlich aus .	Frucht	ausreifen	
440	0	ausreifen	Die Pflanzen sollen nun ihren Jahrestrieb ausreifen , damit sie die Ruhezeit im Winter gut überstehen .	Die Pflanzen sollen nun ihren Jahrestrieb [MASK] , damit sie die Ruhezeit im Winter gut überstehen .	Pflanze	ausreifen	Jahrestrieb
441	0	ausreifen	Aus den Blüten entwickeln sich rote Früchte , die allerdings nur in sehr milden Lagen ausreifen können .	Aus den Blüten entwickeln sich rote Früchte , die allerdings nur in sehr milden Lagen [MASK] können .	Frucht	ausreifen	
442	0	ausreifen	Da sonst die Pflanzen nicht wirklich ausreifen können .	Da sonst die Pflanzen nicht wirklich [MASK] können .	Pflanze	ausreifen	
443	0	ausgereift	Die Nieren des Kindes sind noch nicht voll ausgereift und werden durch zu viel Salz belastet .	Die Nieren des Kindes sind noch nicht voll [MASK] und werden durch zu viel Salz belastet .	Niere	ausreifen	
444	0	abzuschreiben	Er versuchte bis zu den den Herbstferien Texte buchstabenweise von der Tafel abzuschreiben .	Er versuchte bis zu den den Herbstferien Texte buchstabenweise von der Tafel [MASK] .	er	abschreiben	Text
445	1	abschreiben	Fazit : Egal , mit welcher Technik sie antreten : Die Amerikaner sollte man nicht vorzeitig abschreiben .	Fazit : Egal , mit welcher Technik sie antreten : Die Amerikaner sollte man nicht vorzeitig [MASK] .		abschreiben	Amerikaner
446	0	abgeschrieben	Denn Roth hat aus der allzeit perfekten Grammatiksystematik von Panini abgeschrieben .	Denn Roth hat aus der allzeit perfekten Grammatiksystematik von Panini [MASK] .	Roth	abschreiben	
447	1	abzuschreiben	Der Gipfel hat die Banken aufgefordert , bis zu 60 % ihrer Forderungen an Griechenland abzuschreiben .	Der Gipfel hat die Banken aufgefordert , bis zu 60 % ihrer Forderungen an Griechenland [MASK] .		abschreiben	60 %
448	0	abschreiben	Es werden sogenannte Blitzwörter in Millisekunden gezeigt , diese muss man lesen oder abschreiben .	Es werden sogenannte Blitzwörter in Millisekunden gezeigt , diese muss man lesen oder [MASK] .		abschreiben	Blitzwort
449	0	abgeschrieben	Zusatz : diese geschichte ist wahr - die ist nicht ausgedacht oder irgendwo abgeschrieben !	Zusatz : diese geschichte ist wahr - die ist nicht ausgedacht oder irgendwo [MASK] !		abschreiben	Geschichte
450	0	abgeschrieben	Karl-Theodor zu Guttenberg hat abgeschrieben ; na und ?	Karl-Theodor zu Guttenberg hat [MASK] ; na und ?	Karl-Theodor	abschreiben	
451	0	abzuschreiben	Hier ein Teil des Berichten , hab keine Lust die zwei Seiten abzuschreiben !!!	Hier ein Teil des Berichten , hab keine Lust die zwei Seiten [MASK] !!!		abschreiben	Seite
452	1	abschreiben	Den Sonntag können wir wahrscheinlich ersteinmal abschreiben .	Den Sonntag können wir wahrscheinlich ersteinmal [MASK] .		abschreiben	Sonntag
453	1	abgeschrieben	Das Geld und die Cases habe ich bereits abgeschrieben und nochmal werde ich dort nicht bestellen .	Das Geld und die Cases habe ich bereits [MASK] und nochmal werde ich dort nicht bestellen .		abschreiben	Geld
454	0	abzuschreiben	Die Strafarbeiten waren immer , eine Seite aus dem Lesebuch abzuschreiben .	Die Strafarbeiten waren immer , eine Seite aus dem Lesebuch [MASK] .		abschreiben	Seite
455	0	abschreiben	Diktate abschreiben kann jeder aber nicht 365 Tage im Jahr .	Diktate [MASK] kann jeder aber nicht 365 Tage im Jahr .		abschreiben	Diktat
456	1	abzuschreiben	Aber die Windkraft im Binnenland derart abzuschreiben , halte ich für grundfalsch .	Aber die Windkraft im Binnenland derart [MASK] , halte ich für grundfalsch .		abschreiben	Windkraft
457	0	abgeschrieben	Insbesondere darf es weder ganz oder teil­weise noch in Auszügen abgeschrieben noch in son­stiger Weise vervielfältigt werden .	Insbesondere darf es weder ganz oder teil­weise noch in Auszügen [MASK] noch in son­stiger Weise vervielfältigt werden .		abschreiben	
458	0	abschreiben	Das liegt zum Teil daran , dass viele Autoren lediglich voneinander abschreiben .	Das liegt zum Teil daran , dass viele Autoren lediglich voneinander [MASK] .	Autor	abschreiben	
459	1	abgeschrieben	Ist dein toller Jurist schon wieder abgeschrieben ?	Ist dein toller Jurist schon wieder [MASK] ?		abschreiben	Jurist
460	0	abgeschrieben	Guttenberg soll seine Doktorarbeit teilweise abgeschrieben haben .	Guttenberg soll seine Doktorarbeit teilweise [MASK] haben .	Guttenberg	abschreiben	Doktorarbeit
461	1	abgeschrieben	Hatte krankheitshalber diese Reise schon abgeschrieben .	Hatte krankheitshalber diese Reise schon [MASK] .		abschreiben	Reise
462	1	abgeschrieben	Meinen Schal habe ich ziemlich abgeschrieben ; so wirklich richtig gefällt er mir nicht .	Meinen Schal habe ich ziemlich [MASK] ; so wirklich richtig gefällt er mir nicht .	ich	abschreiben	Schal
463	0	abschreiben	Hier durften die Kinder einen Bibelvers mit Feder und Tinte aus dem Tintenfässchen abschreiben .	Hier durften die Kinder einen Bibelvers mit Feder und Tinte aus dem Tintenfässchen [MASK] .	Kind	abschreiben	Bibelvers
464	0	abgeschrieben	Osman hatte den Koran als ein Buch verfasst und ihn zweimal abgeschrieben .	Osman hatte den Koran als ein Buch verfasst und ihn zweimal [MASK] .	Osman	abschreiben	Koran
465	1	abgeschrieben	Er hat Gott ganz einfach abgeschrieben , will nichts mehr mit ihm zu tun haben .	Er hat Gott ganz einfach [MASK] , will nichts mehr mit ihm zu tun haben .	er	abschreiben	Gott
466	0	abgeschrieben	Also habe ich Geschichten aus dem Internet abgeschrieben .	Also habe ich Geschichten aus dem Internet [MASK] .	ich	abschreiben	Geschichte
467	0	abschreiben	Sie müssen in diesem Fall den Text ( zwei Wörter ) im weissen Feld abschreiben .	Sie müssen in diesem Fall den Text ( zwei Wörter ) im weissen Feld [MASK] .		abschreiben	Text
468	1	abgeschrieben	Jahrzehntelang war z.B. der Kongo für die Imperialisten nahezu abgeschrieben .	Jahrzehntelang war z.B. der Kongo für die Imperialisten nahezu [MASK] .		abschreiben	Kongo
469	1	abschreiben	Manuel Neuer sollte man nicht abschreiben , da er jung ist .	Manuel Neuer sollte man nicht [MASK] , da er jung ist .		abschreiben	Neuer
470	1	abgeschrieben	Fast habe ich es abgeschrieben , mich noch total verlieben zu können	Fast habe ich es [MASK] , mich noch total verlieben zu können		abschreiben	
471	1	abgeschrieben	Das heisst noch lange nicht , dass man dem Traum von der grossen Liebe abgeschrieben hat - man hat ihn viel mehr aufgeschoben .	Das heisst noch lange nicht , dass man dem Traum von der grossen Liebe [MASK] hat - man hat ihn viel mehr aufgeschoben .		abschreiben	Traum
472	1	abgeschrieben	Der Erste hat sie schon als tot abgeschrieben	Der Erste hat sie schon als tot [MASK]		abschreiben	
473	1	abzuschreiben	Kein Grund aber das Spiel bereits im Vorfeld abzuschreiben .	Kein Grund aber das Spiel bereits im Vorfeld [MASK] .		abschreiben	Spiel
474	1	anfeuern	Die Begründungen dafür würden die notwendigen Debatten anfeuern , fokussieren .	Die Begründungen dafür würden die notwendigen Debatten [MASK] , fokussieren .		anfeuern	Debatte
475	0	anfeuern	Werde heute abend gleich mal den Kamin anfeuern und mich mit einem schönen Glas Rotwein davor platzieren .	Werde heute abend gleich mal den Kamin [MASK] und mich mit einem schönen Glas Rotwein davor platzieren .		anfeuern	Kamin
476	0	aufschaukeln	Bei hohen Geschwindigkeiten können Wohnanhänger ins Pendeln geraten und sich aufschaukeln .	Bei hohen Geschwindigkeiten können Wohnanhänger ins Pendeln geraten und sich [MASK] .	Wohnanhänger	aufschaukeln	sich
477	1	schaukeln	Ungelöste Konflikte schaukeln sich auf bis hin zur vollständigen Zerstörung .	Ungelöste Konflikte [MASK] sich auf bis hin zur vollständigen Zerstörung .	Konflikt	aufschaukeln	sich
478	0	aufschaukeln	Gestein kann Erdbebenwellen auch aufschaukeln und so zu höheren Intensitäten führen .	Gestein kann Erdbebenwellen auch [MASK] und so zu höheren Intensitäten führen .	Gestein	aufschaukeln	Erdbebenwelle
479	1	aufschaukeln	All dies Geschehen ist miteinander verwoben , kann sich aufschaukeln und in einem Teufelskreis münden .	All dies Geschehen ist miteinander verwoben , kann sich [MASK] und in einem Teufelskreis münden .		aufschaukeln	sich
480	0	aufzuschaukeln	Das Auto regelte zu hart , so dass das Heck anfing sich aufzuschaukeln .	Das Auto regelte zu hart , so dass das Heck anfing sich [MASK] .	Heck	aufschaukeln	sich
481	0	aufschaukeln	Die Karosserie soll sich nicht aufschaukeln , die Reifen nicht an Bodenhaftung verlieren .	Die Karosserie soll sich nicht [MASK] , die Reifen nicht an Bodenhaftung verlieren .	Karosserie	aufschaukeln	sich
482	1	aufschaukeln	Dieses Gefühl kann sich mit der Zeit bis zur Depression aufschaukeln .	Dieses Gefühl kann sich mit der Zeit bis zur Depression [MASK] .	Gefühl	aufschaukeln	sich
483	0	schaukelt	Das Auto schaukelt nicht auf und rollt wirklich sehr gut .	Das Auto [MASK] nicht auf und rollt wirklich sehr gut .	Auto	aufschaukeln	
484	1	aufschaukeln	Man nimmt nun an , dass sich beide Krankheiten wie ein Teufelskreis gegenseitig aufschaukeln .	Man nimmt nun an , dass sich beide Krankheiten wie ein Teufelskreis gegenseitig [MASK] .	Krankheit	aufschaukeln	
485	1	aufschaukeln	Instabile Prozesse sind solche , die Störungen aufschaukeln statt wegzudämpfen .	Instabile Prozesse sind solche , die Störungen [MASK] statt wegzudämpfen .		aufschaukeln	Störung
486	1	aufschaukeln	Die Elemente wirken so zusammen , dass sie sich gegenseitig aufschaukeln .	Die Elemente wirken so zusammen , dass sie sich gegenseitig [MASK] .	Element	aufschaukeln	sich
487	1	aufschaukelten	Es mache wenig Sinn , wenn sich Lichtquellen gegenseitig aufschaukelten , etwa in Einkaufszonen .	Es mache wenig Sinn , wenn sich Lichtquellen gegenseitig [MASK] , etwa in Einkaufszonen .	Lichtquelle	aufschaukeln	sich
488	1	schaukelte	Die Einsamkeit schaukelte sich leicht auf .	Die Einsamkeit [MASK] sich leicht auf .	Einsamkeit	aufschaukeln	sich
489	1	schaukeln	Schmerzen , Hilflosigkeit und dadurch Angst schaukeln sich auf .	Schmerzen , Hilflosigkeit und dadurch Angst [MASK] sich auf .	Schmerz	aufschaukeln	sich
490	1	aufzuschaukeln	Es gehe darum , den Konflikt nicht weiter aufzuschaukeln , so die Bischöfe .	Es gehe darum , den Konflikt nicht weiter [MASK] , so die Bischöfe .		aufschaukeln	Konflikt
491	1	schaukeln	Die erhobenen Stimmen schaukeln nämlich den Gesamtschallpegel auf .	Die erhobenen Stimmen [MASK] nämlich den Gesamtschallpegel auf .	Stimme	aufschaukeln	Gesamtschallpegel
492	1	schaukelt	Es folgen weitere Zusammenstösse zwischen Jesus und den Juden , der Konflikt schaukelt sich auf .	Es folgen weitere Zusammenstösse zwischen Jesus und den Juden , der Konflikt [MASK] sich auf .	Konflikt	aufschaukeln	Sich
493	0	schaukelt	Sonst schwingt der Turm immer nach oder schaukelt sich sogar auf .	Sonst schwingt der Turm immer nach oder [MASK] sich sogar auf .	Turm	aufschaukeln	sich
494	0	aufzuschaukeln	Drohte sich der Anhänger zum Beispiel bei Seitenwind hinter dem Zugwagen aufzuschaukeln , half nur beherztes Bremsen .	Drohte sich der Anhänger zum Beispiel bei Seitenwind hinter dem Zugwagen [MASK] , half nur beherztes Bremsen .	Anhänger	aufschaukeln	Sich
495	0	aufschaukeln	Das sich der Steg so aufschaukeln kann hatten wir noch nicht erlebt .	Das sich der Steg so [MASK] kann hatten wir noch nicht erlebt .	Steg	aufschaukeln	sich
496	0	aufschaukeln	Während er da steht , sieht er plötzlich einen Schiffsrumpf in den Wellen aufschaukeln .	Während er da steht , sieht er plötzlich einen Schiffsrumpf in den Wellen [MASK] .	Schiffrumpf	aufschaukeln	
497	0	aufzuschaukeln	Unvermittelt begannen sie das Fahrzeug , in dem einige Personen sassen , aufzuschaukeln .	Unvermittelt begannen sie das Fahrzeug , in dem einige Personen sassen , [MASK] .		aufschaukeln	Fahrzeug
498	0	aufschaukeln	Einzig lang gezogene Bodenwellen lassen den Sorento ein wenig aufschaukeln .	Einzig lang gezogene Bodenwellen lassen den Sorento ein wenig [MASK] .	Bodenwelle	aufschaukeln	Sorento
499	0	schaukelt	Leistung sehr mager , Motor wird zu warm , Heck schaukelt sich mittem Regler auf .	Leistung sehr mager , Motor wird zu warm , Heck [MASK] sich mittem Regler auf .	Heck	aufschaukeln	Sich
500	1	ausgegraben	Diesen Thread hier habe ich ausgegraben .	Diesen Thread hier habe ich [MASK] .	ich	ausgraben	Thread
501	1	ausgegraben	Viel akkustik Gitarre , viel Musik und eine alte Geschichte ausgegraben .	Viel akkustik Gitarre , viel Musik und eine alte Geschichte [MASK] .		ausgraben	Geschichte
502	0	gräbst	Oder gräbst du Löcher aus ?	Oder [MASK] du Löcher aus ?	du	ausgraben	Loch
503	0	ausgegraben	Im Schlosspark wurden Reste eines römischen Hauses mit Mosaikboden ausgegraben .	Im Schlosspark wurden Reste eines römischen Hauses mit Mosaikboden [MASK] .		ausgraben	Rest
504	1	gräbt	Die Saarbrücker Intendanz gräbt gerne Raritäten aus .	Die Saarbrücker Intendanz [MASK] gerne Raritäten aus .	Intendanz	ausgraben	Rarität
505	0	ausgegraben	Nachdem die Eiche ausgegraben war , erklang das Bochumer Jungenlied mit Pfiff .	Nachdem die Eiche [MASK] war , erklang das Bochumer Jungenlied mit Pfiff .		ausgraben	Eiche
506	0	auszugraben	Schliesslich entschied man sich dafür zunächst in Babylon auszugraben .	Schliesslich entschied man sich dafür zunächst in Babylon [MASK] .		ausgraben	
507	0	ausgraben	Die Jahre vergingen und als die Dorfbewohner das Gold ausgraben wollten , fanden sie es nicht mehr .	Die Jahre vergingen und als die Dorfbewohner das Gold [MASK] wollten , fanden sie es nicht mehr .	Dorfbewohner	ausgraben	Gold
508	1	ausgegraben	Ich hab da mal einen Fragebogen von mir ausgegraben .	Ich hab da mal einen Fragebogen von mir [MASK] .	ich	ausgraben	Fragebogen
509	0	ausgegraben	Hallo , ich bin gerade dabei mein erster Teich zu bauen , ausgegraben haben wir schon .	Hallo , ich bin gerade dabei mein erster Teich zu bauen , [MASK] haben wir schon .		ausgraben	
510	1	ausgegraben	In der Sammlung wurden die meisten Modelle der alten amerikanischen Lichtdesign Klassiker wieder ausgegraben .	In der Sammlung wurden die meisten Modelle der alten amerikanischen Lichtdesign Klassiker wieder [MASK] .		ausgraben	Modell
511	0	gräbt	Man sucht eine kleine Insel , nimmt eine Schaufel mit und gräbt den Schatz aus .	Man sucht eine kleine Insel , nimmt eine Schaufel mit und [MASK] den Schatz aus .		ausgraben	Schatz
512	0	ausgegraben	Igor wurde im Februar 2002 versehentlich bei der Frühjahrsbestellung des Gartens ausgegraben und ins Tierheim gebracht .	Igor wurde im Februar 2002 versehentlich bei der Frühjahrsbestellung des Gartens [MASK] und ins Tierheim gebracht .		ausgraben	Igor
513	0	ausgegraben	Seit 2001 wird dort im Gebiet der Gemeinden Marpingen , Oberthal und Tholey fleissig ausgegraben .	Seit 2001 wird dort im Gebiet der Gemeinden Marpingen , Oberthal und Tholey fleissig [MASK] .		ausgraben	
514	0	ausgegraben	150 Münzen im Lederbeutel aus dem Wald ausgegraben ?	150 Münzen im Lederbeutel aus dem Wald [MASK] ?		ausgraben	Münze
515	0	ausgegraben	Der Neupfarrplatz beherbergt Keller des ehemaligen jüdischen Viertels , ausgegraben in den neunziger Jahren .	Der Neupfarrplatz beherbergt Keller des ehemaligen jüdischen Viertels , [MASK] in den neunziger Jahren .		ausgraben	Keller
516	1	ausgraben	Ich muss wohl mal wieder den Thread durchkucken und die Photos ausgraben .	Ich muss wohl mal wieder den Thread durchkucken und die Photos [MASK] .		ausgraben	Photo
517	0	ausgegraben	Bereits 1935 wurde in Oberschopfheim im Gewann Petersle ein Beil ausgegraben .	Bereits 1935 wurde in Oberschopfheim im Gewann Petersle ein Beil [MASK] .		ausgraben	Beil
518	0	ausgegraben	Es wurden der Palast , der Tempel und ein Stadttor ausgegraben .	Es wurden der Palast , der Tempel und ein Stadttor [MASK] .		ausgraben	Palast
519	0	ausgegraben	In Staraja Ladoga wurden Spielzeugschwerter des 8. 9. Jahrhunderts ausgegraben .	In Staraja Ladoga wurden Spielzeugschwerter des 8. 9. Jahrhunderts [MASK] .		ausgraben	Spielzeugschwert
520	0	ausgegraben	Diese wurden bereits Ende des 19. bzw. zu Anfang des 20. Jahrhunderts ausgegraben .	Diese wurden bereits Ende des 19. bzw. zu Anfang des 20. Jahrhunderts [MASK] .		ausgraben	
521	0	ausgraben	Durch mein unvorsichtiges ausgraben hab ich die Sicherung beschädigt !	Durch mein unvorsichtiges [MASK] hab ich die Sicherung beschädigt !		ausgraben	
522	1	auszugraben	Egal , das Schlimmste ist , Geheimnisse auszugraben , ehe man sie verteilt wie Flugblätter .	Egal , das Schlimmste ist , Geheimnisse [MASK] , ehe man sie verteilt wie Flugblätter .		ausgraben	Geheimnis
523	1	ausgegraben	Da der Artikel ausgegraben wurde .	Da der Artikel [MASK] wurde .		ausgraben	Artikel
524	1	ausgraben	Wer noch so einen alte Konsole besitzt sollte sie mal ruhig wieder ausgraben .	Wer noch so einen alte Konsole besitzt sollte sie mal ruhig wieder [MASK] .		ausgraben	Konsole
525	1	ausgegraben	Er hatte den falschen Artikel ausgegraben !	Er hatte den falschen Artikel [MASK] !		ausgraben	Artikel
526	1	ausgegraben	TMD hat jetzt die wohl älteste Demo Aufnahme von Metallica ausgegraben .	TMD hat jetzt die wohl älteste Demo Aufnahme von Metallica [MASK] .	TMD	ausgraben	Aufnahme
527	1	ausgegraben	Da habt ihr wirklich Erinnerungen bei mir ausgegraben .	Da habt ihr wirklich Erinnerungen bei mir [MASK] .	ihr	ausgraben	Erinnerungen
528	1	ausgegraben	Fragt er mich doch tatsächlich , ob ich das Kriegsbeil schon ausgegraben hätte ?	Fragt er mich doch tatsächlich , ob ich das Kriegsbeil schon [MASK] hätte ?	ich	ausgraben	Kriegsbeil
529	1	auszugraben	Würdest du bitte aufhören , schmerzhafte Erinnerungen auszugraben ?	Würdest du bitte aufhören , schmerzhafte Erinnerungen [MASK] ?		ausgraben	Erinnerung
530	1	ausgegraben	Hallo , ich hab mal wieder mein altes Lieblingsspiel ausgegraben und den ertsen Teil schon durchgespielt .	Hallo , ich hab mal wieder mein altes Lieblingsspiel [MASK] und den ertsen Teil schon durchgespielt .	ich	ausgraben	Lieblingsspiel
531	1	auszugraben	Um das Thema mal wieder auszugraben .	Um das Thema mal wieder [MASK] .		ausgraben	Thema
532	0	absägen	Nimm einfach ein Rohr das ist billig und gut , einfach absägen etc. ..	Nimm einfach ein Rohr das ist billig und gut , einfach [MASK] etc. ..		absägen	
