	label	aspect	sentence	masked_sen	subject	verb	object
1342	0	hämmert	Einen Raum weiter sitzt eine blonde Frau und hämmert auf ihre Tastatur ein .	Einen Raum weiter sitzt eine blonde Frau und [MASK] auf ihre Tastatur ein .	Frau	einhämmern	
1343	0	einzuhämmern	Wer also Probleme mit dem Timing hat , braucht einfach nur wild auf die linke Maustaste einzuhämmern .	Wer also Probleme mit dem Timing hat , braucht einfach nur wild auf die linke Maustaste [MASK] .		einhämmern	
1344	0	hämmerte	Mit einem der auf den Boden liegenden Steine hämmerte Sie auf Krolock ein .	Mit einem der auf den Boden liegenden Steine [MASK] Sie auf Krolock ein .		einhämmern	
1345	0	eingehämmert	Hierbei wurden Streifen bzw. Plättchen aus Messing in das Eisen eingehämmert .	Hierbei wurden Streifen bzw. Plättchen aus Messing in das Eisen [MASK] .		einhämmern	Streifen
1346	0	hämmert	Die Sekretärin ihr gegenüber hämmert auf ihre Schreibmaschine ein und tut so als sei Sarah Luft .	Die Sekretärin ihr gegenüber [MASK] auf ihre Schreibmaschine ein und tut so als sei Sarah Luft .	Sekretärin	einhämmern	
1347	0	hämmert	Der Schmied hämmert auf das Amboss ein .	Der Schmied [MASK] auf das Amboss ein .	Schmied	einhämmern	
1348	1	abbrach	Ich hörte nur noch ein röcheln das Langsam abbrach .	Ich hörte nur noch ein röcheln das Langsam [MASK] .	Röcheln	abbrechen	
1349	1	abgebrochen	Derweil ist Sevens Versuch des Smalltalks von ihr abgebrochen worden	Derweil ist Sevens Versuch des Smalltalks von ihr [MASK] worden		abbrechen	Versuch
1350	0	abgebrochen	Bei Joey sind inzwischen alle Schwanzfedern abgebrochen .	Bei Joey sind inzwischen alle Schwanzfedern [MASK] .	Schwanzfeder	abbrechen	
1351	0	abgebrochen	Ich hatte das erst bemerkt , als mir fast der Schlüssel im Schloss abgebrochen ist .	Ich hatte das erst bemerkt , als mir fast der Schlüssel im Schloss [MASK] ist .	Schlüssel	abbrechen	
1352	1	aufatmen	Ich fürchte aber , Bayern wird nicht aufatmen können .	Ich fürchte aber , Bayern wird nicht [MASK] können .	Bayern	aufatmen	
1353	0	atme	Ich atme auf und öffne die Augen .	Ich [MASK] auf und öffne die Augen .	ich	aufatmen	
1354	1	abgepresst	Die konkrete Einwilligung muss freiwillig , also ohne Druck oder Zwang erfolgen und darf nicht abgepresst sein .	Die konkrete Einwilligung muss freiwillig , also ohne Druck oder Zwang erfolgen und darf nicht [MASK] sein .		abpressen	Einwilligung
1355	0	abgepresst	Bei der Herstellung von Weisswein wird die Maische nach dem Mahlen der Trauben direkt abgepresst .	Bei der Herstellung von Weisswein wird die Maische nach dem Mahlen der Trauben direkt [MASK] .		abpressen	Maische
1356	0	abgepresst	Dabei wird die Saat in einem Verfahrensschritt auf einen Restölgehalt von unter 10 % abgepresst .	Dabei wird die Saat in einem Verfahrensschritt auf einen Restölgehalt von unter 10 % [MASK] .		abpressen	Saat
1357	1	abgepresst	Die Milliarden deutscher Ersparnisse aus langen Friedensjahren in Gold und Devisen wurden uns abgepresst und weggenommen .	Die Milliarden deutscher Ersparnisse aus langen Friedensjahren in Gold und Devisen wurden uns [MASK] und weggenommen .		abpressen	Milliarde
1358	1	abpressen	Die wollten wohl mal wieder neue Forschungsgelder abpressen ...	Die wollten wohl mal wieder neue Forschungsgelder [MASK] ...		abpressen	Forschungsgeld
1359	1	abgepresst	In der diesen Prozessen voraufgehenden Polizei - und Geheimdiensthaft wurden ihnen häufig Geständnisse unter Folter abgepresst .	In der diesen Prozessen voraufgehenden Polizei - und Geheimdiensthaft wurden ihnen häufig Geständnisse unter Folter [MASK] .		abpressen	Geständnis
1360	1	abgepresst	Sie haben auch lokalen Bauern Geld abgepresst .	Sie haben auch lokalen Bauern Geld [MASK] .		abpressen	Geld
1361	1	abpressen	Den Aufenthaltsort des Hexers konnten sie einer Dienerin Barsoks abpressen .	Den Aufenthaltsort des Hexers konnten sie einer Dienerin Barsoks [MASK] .		abpressen	Aufenthaltsort
1362	0	abgepresst	Zu Hause angekommen müssen die Trauben jetzt sehr schnell verarbeitet werden , damit sie gefroren abgepresst werden .	Zu Hause angekommen müssen die Trauben jetzt sehr schnell verarbeitet werden , damit sie gefroren [MASK] werden .		abpressen	Traube
1363	0	abgepresst	Ursüsse Nach der Zuckerrohrernte wird etwa 50 % des Rohgewichts als Saft abgepresst .	Ursüsse Nach der Zuckerrohrernte wird etwa 50 % des Rohgewichts als Saft [MASK] .		abpressen	50 %
1364	0	abgepresst	In dieser wird das wasserhaltige Rechengut abgepresst und in einen deponiefähigen Zustand gebracht .	In dieser wird das wasserhaltige Rechengut [MASK] und in einen deponiefähigen Zustand gebracht .		abpressen	Rechengut
1365	0	abgepresst	Im Gegensatz dazu wird bei der Weissweinherstellung der Traubensaft direkt abgepresst und dann getrennt vergoren .	Im Gegensatz dazu wird bei der Weissweinherstellung der Traubensaft direkt [MASK] und dann getrennt vergoren .		abpressen	Traubensaft
1366	0	abgepresst	Dadurch steigt der Blutdruck in den Blutgefässen und Flüssigkeit wird in die Gewebespalten abgepresst .	Dadurch steigt der Blutdruck in den Blutgefässen und Flüssigkeit wird in die Gewebespalten [MASK] .		abpressen	Flüssigkeit
1367	0	abgepresst	Anschliessend wird das Ganze abgepresst , also die festen Restbestandteile entfernt .	Anschliessend wird das Ganze [MASK] , also die festen Restbestandteile entfernt .		abpressen	
1368	0	abgepresst	Die Trauben werden nach der Ernte gemahlen und nach einigen Stunden Standzeit abgepresst .	Die Trauben werden nach der Ernte gemahlen und nach einigen Stunden Standzeit [MASK] .		abpressen	Trauben
1369	0	abgepresst	Nach circa 4 - 8 Tagen kann die Maische abgepresst werden .	Nach circa 4 - 8 Tagen kann die Maische [MASK] werden .		abpressen	Maische
1370	1	abgepresst	Grossbritannien wurde auf dem Dreier-Gipfel Zustimmung zur deutsch-französisch vorangetriebenen europäischen Verteidigungspolitik abgepresst ...	Grossbritannien wurde auf dem Dreier-Gipfel Zustimmung zur deutsch-französisch vorangetriebenen europäischen Verteidigungspolitik [MASK] ...		abpressen	Zustimmung
1371	0	abpressen	Aus Pflaumen lässt sich Saft kaum abpressen .	Aus Pflaumen lässt sich Saft kaum [MASK] .		abpressen	Saft
1372	1	abgepresst	Mubarak und sein Clan verfügten über enormen Reichtum , den sie den Werktätigen abgepresst haben .	Mubarak und sein Clan verfügten über enormen Reichtum , den sie den Werktätigen [MASK] haben .		abpressen	Reichtum
1373	1	abgepresst	Mit derselben Behauptung werden Studierenden in den USA , Studiengebühren abgepresst .	Mit derselben Behauptung werden Studierenden in den USA , Studiengebühren [MASK] .		abpressen	Studiengebühr
1374	0	abpressen	Anschliessend abpressen und wieder mit Sahne auf 250 ml auffüllen .	Anschliessend [MASK] und wieder mit Sahne auf 250 ml auffüllen .		abpressen	
1375	1	abgepresst	Einigen Jungs wurden jeden Morgen auf einem U-Bahnhof die Zigaretten abgepresst .	Einigen Jungs wurden jeden Morgen auf einem U-Bahnhof die Zigaretten [MASK] .		abpressen	Zigarette
1376	0	abgepresst	Bei Schiller-Wein wird ja die rote und weisse Traube gemeinsam abgepresst .	Bei Schiller-Wein wird ja die rote und weisse Traube gemeinsam [MASK] .		abpressen	Traube
1377	1	abgepresst	Zugleich entstand ein schwunghafter Handel mit Kunst , die den verfolgten Juden abgepresst oder geraubt wurde .	Zugleich entstand ein schwunghafter Handel mit Kunst , die den verfolgten Juden [MASK] oder geraubt wurde .		abpressen	Kunst
1378	0	abgepresst	Die entzuckerten Schnitzel werden abgepresst und die Faserstoffe im Futter verwendet ...	Die entzuckerten Schnitzel werden [MASK] und die Faserstoffe im Futter verwendet ...		abpressen	Schnitzel
1379	1	abgepresst	Denn die von ihm nicht gezahlten Steuern werden den ehrlicheren abgepresst .	Denn die von ihm nicht gezahlten Steuern werden den ehrlicheren [MASK] .		abpressen	Steuer
1380	0	abpressen	Die Gurke in ein sauberes Tuch geben und den Saft abpressen .	Die Gurke in ein sauberes Tuch geben und den Saft [MASK] .		abpressen	Saft
1381	1	abzupressen	Sie versuchten mit mit Reizgas und Schlägen dem Opfer Beute abzupressen .	Sie versuchten mit mit Reizgas und Schlägen dem Opfer Beute [MASK] .		abpressen	Beute
1382	1	abpressen	Irgendwo müssen die mit ihrem vielen Geld ja hin , das sie dem kleinen Mann abpressen .	Irgendwo müssen die mit ihrem vielen Geld ja hin , das sie dem kleinen Mann [MASK] .		abpressen	Geld
1383	1	abpressen	Wangechis Bruder Paul ist unverhohlen , wenn er seinem Schwager Geld für einen neuen Traktor abpressen will .	Wangechis Bruder Paul ist unverhohlen , wenn er seinem Schwager Geld für einen neuen Traktor [MASK] will .		abpressen	Geld
1384	1	abgepresst	Männer aus allen Ständen wurden angelockt , und wertvolle Geschenke wurden ihnen auf ziemlich unverschämte Weise abgepresst .	Männer aus allen Ständen wurden angelockt , und wertvolle Geschenke wurden ihnen auf ziemlich unverschämte Weise [MASK] .		abpressen	Geschenk
1385	0	abpressen	Das grösste Problem ist meist das Auflegen , so das man das Rad abpressen kann .	Das grösste Problem ist meist das Auflegen , so das man das Rad [MASK] kann .		abpressen	Rad
1386	1	abpressen	Man habe ihr das Geständnis abpressen wollen , sie hätte die Informationen an die Medien weitergegeben .	Man habe ihr das Geständnis [MASK] wollen , sie hätte die Informationen an die Medien weitergegeben .		abpressen	Geständnis
1387	1	abpressen	paar Drachmen Steuern abpressen , unterschlagen selbst gewaltige Summen !	paar Drachmen Steuern [MASK] , unterschlagen selbst gewaltige Summen !		abpressen	Steuer
1388	1	abzupressen	So versuchte Morgoth , Húrin unter Folter die Lage Gondolins abzupressen .	So versuchte Morgoth , Húrin unter Folter die Lage Gondolins [MASK] .		abpressen	Lage
1389	0	abgepresst	Dadurch wird Flüssigkeit über die Gefässwand in das umliegende Gewebe abgepresst .	Dadurch wird Flüssigkeit über die Gefässwand in das umliegende Gewebe [MASK] .		abpressen	Flüssigkeit
1390	0	abgepresst	Das Hämoglobin wird aus den Blutkörperchen abgepresst und landet daher im Urin .	Das Hämoglobin wird aus den Blutkörperchen [MASK] und landet daher im Urin .		abpressen	Hämoglobin
1391	0	abpressen	Lippen am Papiertuch abpressen , erneut abpudern , noch einmal Lippenstift darüber geben .	Lippen am Papiertuch [MASK] , erneut abpudern , noch einmal Lippenstift darüber geben .		abpressen	Lippe
1392	1	strahlte	Connor strahlte ihn an , lief auf ihn zu und umarmte ihn stürmisch .	Connor [MASK] ihn an , lief auf ihn zu und umarmte ihn stürmisch .	Connor	anstrahlen	
1393	1	anstrahlen	Augen , die einen so anstrahlen , vergessen einen nicht .	Augen , die einen so [MASK] , vergessen einen nicht .	Auge	anstrahlen	
1394	1	anstrahlt	Siehst du , wie dein Schwesterchen dich anstrahlt ?	Siehst du , wie dein Schwesterchen dich [MASK] ?	Schwesterchen	anstrahlen	
1395	1	strahlte	Sanft legte er einen Arm um sie und strahlte sie an .	Sanft legte er einen Arm um sie und [MASK] sie an .		anstrahlen	
1396	0	angestrahlt	Sie wurde ständig von einem Scheinwerferlicht angestrahlt und hin und wieder flog irgendein Gegenstand in diesen Flur .	Sie wurde ständig von einem Scheinwerferlicht [MASK] und hin und wieder flog irgendein Gegenstand in diesen Flur .		anstrahlen	
1397	1	strahlte	Und unsere Mutter strahlte ihre Gäste an und sagte : Zwillinge !	Und unsere Mutter [MASK] ihre Gäste an und sagte : Zwillinge !	Mutter	anstrahlen	Gast
1398	1	strahlte	Noch einmal strahlte sie ihn an , ging dann zu ihrem Einkaufswagen zurück .	Noch einmal [MASK] sie ihn an , ging dann zu ihrem Einkaufswagen zurück .	sie	anstrahlen	ihn
1399	1	strahlen	Denn rote , müde Augen strahlen niemanden an .	Denn rote , müde Augen [MASK] niemanden an .	Auge	anstrahlen	niemand
1400	0	strahlen	Weisse LED eingelassen in der Wand mit Edelstahlabdeckung strahlen jede Treppenstufe seitlich an .	Weisse LED eingelassen in der Wand mit Edelstahlabdeckung [MASK] jede Treppenstufe seitlich an .	LED	anstrahlen	Treppenstufe
1401	1	strahlt	Der junge Mann von der Rezeption strahlt mich an .	Der junge Mann von der Rezeption [MASK] mich an .	Mann	anstrahlen	mich
1402	0	angestrahlt	lag daran , dass die originale burg von vorn von der Sonne angestrahlt wurde .	lag daran , dass die originale burg von vorn von der Sonne [MASK] wurde .		anstrahlen	burg
1403	0	angestrahlt	meine Rotfedern habe ich nachts mit einer starken Taschenlampe angestrahlt und dann mit gekeschert .	meine Rotfedern habe ich nachts mit einer starken Taschenlampe [MASK] und dann mit gekeschert .		anstrahlen	Rotfeder
1404	1	strahlte	Er liess endlich meine Hand los , strahlte mich aber weiterhin an .	Er liess endlich meine Hand los , [MASK] mich aber weiterhin an .		anstrahlen	
1405	0	angestrahlt	Besonders wenn das Wetter toll ist , man Abends draussen sitzt und die Burg dann angestrahlt wird ...	Besonders wenn das Wetter toll ist , man Abends draussen sitzt und die Burg dann [MASK] wird ...		anstrahlen	Burg
1406	1	strahlte	Sie strahlte ihn an und umarmte ihn dann ganz fest .	Sie [MASK] ihn an und umarmte ihn dann ganz fest .		anstrahlen	
1407	0	anstrahlen	Du könntest die Lichtatrappen von unten mit weissen SMD LED anstrahlen , wäre eine Möglichkeit .	Du könntest die Lichtatrappen von unten mit weissen SMD LED [MASK] , wäre eine Möglichkeit .		anstrahlen	Lichtattrape
1408	1	strahlt	Sitzt meine kleine Frau soeben neben mir am Computer und strahlt mich an .	Sitzt meine kleine Frau soeben neben mir am Computer und [MASK] mich an .		anstrahlen	
1409	1	strahlte	Auch Katrin strahlte mich an und flüsterte leise : Super , hast echt was drauf .	Auch Katrin [MASK] mich an und flüsterte leise : Super , hast echt was drauf .	Katrin	anstrahlen	mich
1410	1	strahlte	Marilena strahlte ihn an , aber nur wenn es dir nichts ausmacht .	Marilena [MASK] ihn an , aber nur wenn es dir nichts ausmacht .	Marilena	anstrahlen	ihn
1411	0	strahlte	Ein Scheinwerfer strahlte sie an .	Ein Scheinwerfer [MASK] sie an .	Scheinwerfer	anstrahlen	sie
1412	0	angestrahlt	Seit 2003 wird der Turm der Kirche nach Anbruch der Dunkelheit angestrahlt .	Seit 2003 wird der Turm der Kirche nach Anbruch der Dunkelheit [MASK] .		anstrahlen	Turm
1413	0	angestrahlt	Der Masalu wird toll von der Sonne angestrahlt .	Der Masalu wird toll von der Sonne [MASK] .		anstrahlen	Masalu
1414	0	angestrahlt	Die Lichtabstrahlung lässt sich besser lenken , wodurch Schlafzimmer nicht mehr unnötig angestrahlt werden .	Die Lichtabstrahlung lässt sich besser lenken , wodurch Schlafzimmer nicht mehr unnötig [MASK] werden .		anstrahlen	Schlafzimmer
1415	1	strahlt	Das Kind strahlt mich an .	Das Kind [MASK] mich an .	Kind	anstrahlen	mich
1416	1	strahlte	und dann strahlte ihn Timothys Mom an , die ebenfalls von den Darbietungen erfüllt war .	und dann [MASK] ihn Timothys Mom an , die ebenfalls von den Darbietungen erfüllt war .	Mom	anstrahlen	ihn
1417	0	angestrahlt	Wir wurden damals mit ihren Scheinwerfern angestrahlt , von den hohen Albaner Bergen !	Wir wurden damals mit ihren Scheinwerfern [MASK] , von den hohen Albaner Bergen !		anstrahlen	
1418	0	antwortet	Wird ein Flugzeug von einem Radarimpuls angestrahlt , so antwortet ein Transponder mit dem Daten des Fluges .	Wird ein Flugzeug von einem Radarimpuls angestrahlt , so [MASK] ein Transponder mit dem Daten des Fluges .		anstrahlen	Flugzeug
1419	1	strahlt	Er hat zunächst nur Augen für sie , spricht mit ihr , strahlt sie an .	Er hat zunächst nur Augen für sie , spricht mit ihr , [MASK] sie an .		anstrahlen	
1420	1	strahlten	Ihr grossen , ausdrucksvollen dunklen Augen strahlten mich an .	Ihr grossen , ausdrucksvollen dunklen Augen [MASK] mich an .	Auge	anstrahlen	mich
1421	0	angestrahlt	Sie wird von den Lichtern auf der Brücke angestrahlt .	Sie wird von den Lichtern auf der Brücke [MASK] .		anstrahlen	
1422	0	angestrahlt	Leuchtet sehr hell , wenn es vom Scheinwerfer eines vorbeifahrenden Autos angestrahlt wird !	Leuchtet sehr hell , wenn es vom Scheinwerfer eines vorbeifahrenden Autos [MASK] wird !		anstrahlen	
1423	0	angestrahlt	Es ist definitiv das Licht der Kirche , welche von unten angestrahlt wird !	Es ist definitiv das Licht der Kirche , welche von unten [MASK] wird !		anstrahlen	Kirche
1424	0	angestrahlt	am 28. november 2004 wird die Frauenkirche das erste mal komplett angestrahlt sein !	am 28. november 2004 wird die Frauenkirche das erste mal komplett [MASK] sein !		anstrahlen	Frauenkirche
1425	0	anstrahlt	Das ist das Licht , das von der Erde den Mond anstrahlt .	Das ist das Licht , das von der Erde den Mond [MASK] .	der	anstrahlen	Mond
1426	1	strahlte	Sie strahlte mich wieder an und umarmte mich .	Sie [MASK] mich wieder an und umarmte mich .	sie	anstrahlen	
1427	0	angestrahlt	Doch ja , die Schornsteine gegenüber werden schon angestrahlt !	Doch ja , die Schornsteine gegenüber werden schon [MASK] !		anstrahlen	Schornstein
1428	0	angestrahlt	Abends wird die Kirche zumeist angestrahlt .	Abends wird die Kirche zumeist [MASK] .		anstrahlen	Kirche
1429	1	strahlte	Ich strahlte ihn an und langsam kam sein Gesicht immer näher .	Ich [MASK] ihn an und langsam kam sein Gesicht immer näher .	ich	anstrahlen	ihn
1430	1	strahlte	Er strahlte sie förmlich an , wandte sich dann jedoch wieder den Kontrollen zu .	Er [MASK] sie förmlich an , wandte sich dann jedoch wieder den Kontrollen zu .	er	anstrahlen	sie
1431	0	angestrahlt	Nicht durch Kfz oder Fahrrad angestrahlt .	Nicht durch Kfz oder Fahrrad [MASK] .		anstrahlen	
1432	1	strahlt	Frau Kiefer strahlt sie gleich mütterlich an .	Frau Kiefer [MASK] sie gleich mütterlich an .	Frau	anstrahlen	sie
1433	0	strahlen	Die Studioblitze stehen seitlich neben dem Motiv und strahlen es an .	Die Studioblitze stehen seitlich neben dem Motiv und [MASK] es an .	Studioblitz	anstrahlen	Motiv
1434	1	strahlt	Der Hello Kitty Aufkleber auf dem Gehäuse strahlt mich an .	Der Hello Kitty Aufkleber auf dem Gehäuse [MASK] mich an .	Aufkleber	anstrahlen	mich
1435	1	strahlen	Zwei rote Augen strahlen uns an .	Zwei rote Augen [MASK] uns an .	Auge	anstrahlen	uns
1436	0	aufgeladen	Sie mussten vor dem Auswerfen mit der Taschenlampe angestrahlt und aufgeladen werden .	Sie mussten vor dem Auswerfen mit der Taschenlampe angestrahlt und [MASK] werden .		anstrahlen	
1437	0	angestrahlt	Eindrucksvoll ist die Wachtenburg vor allem abends , wenn die ausladende Burganlage angestrahlt wird .	Eindrucksvoll ist die Wachtenburg vor allem abends , wenn die ausladende Burganlage [MASK] wird .		anstrahlen	Burganlage
1438	1	strahlte	Ich strahlte ihn fröhlich an und er zurück .	Ich [MASK] ihn fröhlich an und er zurück .	Ich	anstrahlen	
1439	0	angestrahlt	Blasse Körper , nur von fahlem Licht angestrahlt , bestimmen die ersten Minuten des Films .	Blasse Körper , nur von fahlem Licht [MASK] , bestimmen die ersten Minuten des Films .		anstrahlen	Körper
1440	1	male	Ein Ding der Unmöglichkiet , ich komm da nicht zur Ruhe und male mir das Schlimmste aus .	Ein Ding der Unmöglichkiet , ich komm da nicht zur Ruhe und [MASK] mir das Schlimmste aus .		ausmalen	schlimme
1441	0	ausmalen	Deine Eltern werden sicherlich überrascht sein , wie toll du diese Zeichen ausmalen kannst .	Deine Eltern werden sicherlich überrascht sein , wie toll du diese Zeichen [MASK] kannst .		ausmalen	Zeichen
1442	1	ausmalen	Was dieser professionelle Umgang an positiver Imagebildung unter den Usern erzeugt , kann sich jeder selbst ausmalen .	Was dieser professionelle Umgang an positiver Imagebildung unter den Usern erzeugt , kann sich jeder selbst [MASK] .		ausmalen	
1443	1	ausgemalt	Du hattest Dir ausgemalt Dich unsicher und unwohl zu fühlen .	Du hattest Dir [MASK] Dich unsicher und unwohl zu fühlen .	du	ausmalen	
1444	0	ausgemalt	Statt Ringe oder Stäbchen werden Mandalas ausgemalt .	Statt Ringe oder Stäbchen werden Mandalas [MASK] .		ausmalen	Mandala
1445	1	ausgemalt	Im 6. Kapitel werden zunächst die kosmischen Ereignisse ausgemalt , die dem Jüngsten Tag unmittelbar vorangehen .	Im 6. Kapitel werden zunächst die kosmischen Ereignisse [MASK] , die dem Jüngsten Tag unmittelbar vorangehen .		ausmalen	Ereignis
1446	0	ausgemalt	Die Bilder wurden mit der Hand ausgemalt .	Die Bilder wurden mit der Hand [MASK] .		ausmalen	Bild
1447	1	ausmalen	Wenn das passiert , kann sich jeder ausmalen was passiert !	Wenn das passiert , kann sich jeder [MASK] was passiert !		ausmalen	sich
1448	0	ausgemalt	Die Gewölbe waren mit Fresken ausgemalt und die Wände mit buntem Holz verkleidet oder tapeziert .	Die Gewölbe waren mit Fresken [MASK] und die Wände mit buntem Holz verkleidet oder tapeziert .		ausmalen	Gewölbe
1449	0	ausgemalt	Die Flügel sind oft mit einem kunstvoll verzierten Ovoid ausgemalt .	Die Flügel sind oft mit einem kunstvoll verzierten Ovoid [MASK] .		ausmalen	Flügel
1450	1	ausmalen	Jeder darf sich in seiner eigenen Phantasie ausmalen was er da drunter versteht .	Jeder darf sich in seiner eigenen Phantasie [MASK] was er da drunter versteht .		ausmalen	sich
1451	1	ausgemalt	Wie er sich ausgemalt hat , dass er und sein Bruder die dumme Tante Edith ärgern .	Wie er sich [MASK] hat , dass er und sein Bruder die dumme Tante Edith ärgern .		ausmalen	sich
1452	1	auszumalen	Nicht auszumalen , wenn ein Unfall dort eine Ölpest auslöst .	Nicht [MASK] , wenn ein Unfall dort eine Ölpest auslöst .		ausmalen	
1453	1	ausmalen	Das will ich mir garnicht ausmalen .	Das will ich mir garnicht [MASK] .		ausmalen	
1454	1	ausmalen	die Folgen will man sich nicht ausmalen !	die Folgen will man sich nicht [MASK] !		ausmalen	sich
1455	1	ausgemalt	Dabei muss er einige bittere Enttäuschungen erleben , die parodistisch ausgemalt werden .	Dabei muss er einige bittere Enttäuschungen erleben , die parodistisch [MASK] werden .		ausmalen	Enttäuschung
1456	0	ausmalen	Kein Problem , hier im Internet können die Kids ganz einfach Bilder malen und ausmalen .	Kein Problem , hier im Internet können die Kids ganz einfach Bilder malen und [MASK] .	Kind	ausmalen	Bild
1457	0	ausmalen	Dazu müssen Sie lediglich die Pupille mitsamt der Augenäderchen eingravieren und anschliessend ausmalen .	Dazu müssen Sie lediglich die Pupille mitsamt der Augenäderchen eingravieren und anschliessend [MASK] .		ausmalen	Pupille
1458	0	ausgemalt	Schon nach ein paar Minuten war das Bild ausgemalt .	Schon nach ein paar Minuten war das Bild [MASK] .		ausmalen	Bild
1459	1	ausmalen	Was dann passiert , kann sich jeder in seiner Fantasie ausmalen .	Was dann passiert , kann sich jeder in seiner Fantasie [MASK] .		ausmalen	sich
1460	0	ausgemalt	Die ganz leeren Felder füllen einfach nur die Mauer und können gern ausgemalt werden .	Die ganz leeren Felder füllen einfach nur die Mauer und können gern [MASK] werden .		ausmalen	Feld
1461	1	ausgemalt	Von wegen Entschleunigung und meditative Ruhe wie sie sich das ausgemalt hatte .	Von wegen Entschleunigung und meditative Ruhe wie sie sich das [MASK] hatte .	sie	ausmalen	
1462	1	ausmalen	Was das für Probleme mit sich bringen kann , darf sich jeder selber ausmalen .	Was das für Probleme mit sich bringen kann , darf sich jeder selber [MASK] .		ausmalen	sich
1463	1	ausmalen	Die möglichen Folgen , wenn jemand da unbedarft hinkommt sollte sich jede r selbst ausmalen können .	Die möglichen Folgen , wenn jemand da unbedarft hinkommt sollte sich jede r selbst [MASK] können .		ausmalen	sich
1464	1	auszumalen	Ich brauche mir ein solches Szenario gar nicht auszumalen .	Ich brauche mir ein solches Szenario gar nicht [MASK] .	ich	ausmalen	Szenario
1465	0	ausmalen	Darauf konnten die Teilnehmer die von ihnen gewünschten Motiven übertragen und ausmalen .	Darauf konnten die Teilnehmer die von ihnen gewünschten Motiven übertragen und [MASK] .	Teilnehmer	ausmalen	Motiv
1466	0	ausmalen	Augenhöhlen und Nasenspitze mit dem Pinsel tiefschwarz ausmalen .	Augenhöhlen und Nasenspitze mit dem Pinsel tiefschwarz [MASK] .		ausmalen	Augenhöhle
1467	0	ausmalen	Kinder lieben sie , denn sie können die Felder bunt ausmalen .	Kinder lieben sie , denn sie können die Felder bunt [MASK] .		ausmalen	Feld
1468	0	ausmalen	Die Allerjüngsten können inzwischen die winterlichen Motive ausmalen .	Die Allerjüngsten können inzwischen die winterlichen Motive [MASK] .		ausmalen	Motiv
1469	0	ausmalen	Nun heisst es einfach mit Abtönfarben oder fertig abgetönten Dispersionen ausmalen .	Nun heisst es einfach mit Abtönfarben oder fertig abgetönten Dispersionen [MASK] .		ausmalen	
1470	0	ausgemalt	Die Höhlen sind sehr schön , mit buddhistischen Motiven bis an die Decke ausgemalt .	Die Höhlen sind sehr schön , mit buddhistischen Motiven bis an die Decke [MASK] .		ausmalen	Höhle
1471	0	ausgemalt	Strand - und Küstenmotive können hier mit Bunt - oder Filzstiften ausgemalt werden .	Strand - und Küstenmotive können hier mit Bunt - oder Filzstiften [MASK] werden .		ausmalen	Küstenmotiv
1472	1	abgelegt	Rica hat ihre anfängliche Scheu Menschen gegenüber fast abgelegt .	Rica hat ihre anfängliche Scheu Menschen gegenüber fast [MASK] .	Rica	ablegen	Scheu
1473	1	abgelegt	Sie war mit ihrem Partner vor den Altar getreten und hatte den Schwur abgelegt	Sie war mit ihrem Partner vor den Altar getreten und hatte den Schwur [MASK]		ablegen	Schwur
1474	1	ablegen	Mitnichten will ich unüberlegt meinen Status ablegen .	Mitnichten will ich unüberlegt meinen Status [MASK] .		ablegen	Status
1475	1	legt	Der Pfarrer legt seinen ernsten Gesichtsausdruck ab .	Der Pfarrer [MASK] seinen ernsten Gesichtsausdruck ab .	Pfarrer	ablegen	Gesichtsausdruck
1476	1	ablegen	Und auch die anderen sollten ihren falschen Stolz ablegen .	Und auch die anderen sollten ihren falschen Stolz [MASK] .		ablegen	Stolz
1477	1	abzulegen	Oft geht es darum , unpassende Rhetorik-Standards wieder abzulegen	Oft geht es darum , unpassende Rhetorik-Standards wieder [MASK]		ablegen	Rhetorik-Standard
1478	0	abgelegt	Bereits ab September werden die ersten rot gefärbten Eier abgelegt .	Bereits ab September werden die ersten rot gefärbten Eier [MASK] .		ablegen	Ei
